{
  "$schema": "https://json-schema.org/draft/2020-12/schema",
  "$id": "https://github.com/uulab-official/drawio-skills/schemas/review-trust.schema.json",
  "title": "Delegated diagram review trust policy",
  "type": "object",
  "additionalProperties": false,
  "required": ["format", "organization", "requirements", "delegations"],
  "properties": {
    "format": {"const": "drawio-review-trust/v1"},
    "organization": {"type": "string", "minLength": 1, "maxLength": 256},
    "requirements": {
      "type": "object",
      "additionalProperties": false,
      "required": ["minimum_approvals", "required_roles", "required_teams"],
      "properties": {
        "minimum_approvals": {"type": "integer", "minimum": 1, "maximum": 100},
        "required_roles": {
          "type": "array",
          "uniqueItems": true,
          "items": {"type": "string", "minLength": 1, "maxLength": 128}
        },
        "required_teams": {
          "type": "array",
          "uniqueItems": true,
          "items": {"type": "string", "minLength": 1, "maxLength": 128}
        }
      }
    },
    "delegations": {
      "type": "array",
      "minItems": 1,
      "maxItems": 500,
      "items": {"$ref": "#/$defs/delegation"}
    }
  },
  "$defs": {
    "sha256": {"type": "string", "pattern": "^[0-9a-f]{64}$"},
    "timestamp": {
      "type": "string",
      "pattern": "^\\d{4}-\\d{2}-\\d{2}T\\d{2}:\\d{2}:\\d{2}Z$"
    },
    "delegation": {
      "type": "object",
      "additionalProperties": false,
      "required": [
        "id", "principals", "roles", "teams", "valid_from", "valid_until",
        "allowed_signers", "allowed_signers_sha256"
      ],
      "properties": {
        "id": {"type": "string", "pattern": "^[a-z][a-z0-9-]{0,63}$"},
        "principals": {
          "type": "array",
          "minItems": 1,
          "uniqueItems": true,
          "items": {"type": "string", "minLength": 1, "maxLength": 256}
        },
        "roles": {
          "type": "array",
          "minItems": 1,
          "uniqueItems": true,
          "items": {"type": "string", "minLength": 1, "maxLength": 128}
        },
        "teams": {
          "type": "array",
          "minItems": 1,
          "uniqueItems": true,
          "items": {"type": "string", "minLength": 1, "maxLength": 128}
        },
        "valid_from": {"$ref": "#/$defs/timestamp"},
        "valid_until": {"$ref": "#/$defs/timestamp"},
        "allowed_signers": {
          "type": "string",
          "minLength": 1,
          "description": "Trust-root-relative OpenSSH allowed signers path."
        },
        "allowed_signers_sha256": {"$ref": "#/$defs/sha256"}
      }
    }
  }
}
